{
  "schemaVersion": 1,
  "videoId": "dQw4w9WgXcQ",
  "title": "Placeholder discussion: housing supply debate",
  "generatedAt": "2026-08-27T16:00:00Z",
  "expiresAt": "2026-08-28T16:00:00Z",
  "events": [
    {
      "id": "evt_001",
      "startTime": 92.4,
      "triggerTime": 98.6,
      "endTime": 105.2,
      "speaker": "Speaker A",
      "type": "unsupported_claim",
      "title": "Claim needs support",
      "summary": "States that rents fell forty percent without naming a source or period.",
      "confidence": 0.88,
      "evidence": "Rents came down by about forty percent after that policy passed."
    },
    {
      "id": "evt_002",
      "startTime": 210.0,
      "triggerTime": 216.75,
      "endTime": 228.3,
      "speaker": "Speaker B",
      "type": "strawman",
      "title": "Position restated unfairly",
      "summary": "Recasts the opposing view as wanting no regulation at all, which was not argued.",
      "confidence": 0.72,
      "evidence": "So your position is that we should just let developers build whatever they want anywhere."
    },
    {
      "id": "evt_003",
      "startTime": 338.2,
      "triggerTime": 342.8,
      "endTime": 349.1,
      "speaker": "Speaker A",
      "type": "contradiction",
      "title": "Conflicts with an earlier statement",
      "summary": "Now says permitting speed is irrelevant after earlier calling it the main constraint.",
      "confidence": 0.91,
      "evidence": "Permitting timelines are really beside the point here."
    },
    {
      "id": "evt_004",
      "startTime": 507.5,
      "triggerTime": 515.05,
      "endTime": 526.9,
      "speaker": "Speaker B",
      "type": "evasion",
      "title": "Question not answered",
      "summary": "Asked for the cost per unit and answers with a general statement about priorities.",
      "confidence": 0.64,
      "evidence": "What matters is that we are finally treating this as an emergency."
    },
    {
      "id": "evt_005",
      "startTime": 688.1,
      "triggerTime": 694.4,
      "endTime": 703.0,
      "speaker": "Speaker A",
      "type": "missing_premise",
      "title": "Conclusion skips a step",
      "summary": "Concludes that supply alone fixes affordability without establishing the link.",
      "confidence": 0.77,
      "evidence": "Build more units and affordability takes care of itself."
    }
  ]
}
